{"assessment_date":"2026-08-08","boundaries":{"autonomous_memory_authorized":false,"autonomous_merge_authorized":false,"autonomous_skill_promotion_authorized":false,"background_execution_authorized":false,"codex_start_authorized":false,"external_actions_authorized":false,"founder_accountability_preserved":true,"hermes_activation_authorized":false,"implementation_authorized":false,"installation_authorized":false,"model_fanout_authorized":false,"oauth_authorized":false,"paid_services_authorized":false,"production_deployment_authorized":false,"real_client_data_enabled":false,"runtime_activation_authorized":false},"capability_assessments":[{"capability_id":"HERMES-CAP-SKILLS","denied_raw_actions":["hub_install_without_review","automatic_update","canonical_write","direct_external_send"],"integration_points":["P1.1","P1.4","P4.1","P4.2","P10.3","P10.4"],"offdata_mode":"candidate_procedure_library_only","owning_imp_phases":["IMP-P1","IMP-P4","IMP-P10"],"required_controls":["repository_canonical_skills","read_only_external_directory","checksum_and_provenance","independent_review","explicit_promotion"],"status":"planned_not_implemented","upstream_surface":"skills_progressive_disclosure_and_bundles"},{"capability_id":"HERMES-CAP-LEARN","denied_raw_actions":["canonical_skill_write","automatic_method_promotion","background_skill_write"],"integration_points":["P4.4","P10.2","P10.3","P10.4"],"offdata_mode":"suggestion_only_candidate_drafting","owning_imp_phases":["IMP-P4","IMP-P10"],"required_controls":["write_approval","noncanonical_staging","provenance_capture","regression_tests","founder_promotion_gate"],"status":"planned_not_implemented","upstream_surface":"learn_and_skill_manage"},{"capability_id":"HERMES-CAP-JOURNEY","denied_raw_actions":["journey_edit_as_canonical_change","journey_delete_as_governance_action"],"integration_points":["P4.4","P10.2","P10.4"],"offdata_mode":"read_only_suggestion_observability","owning_imp_phases":["IMP-P4","IMP-P10"],"required_controls":["no_canonical_authority","read_only_consumption","audit_link_if_used"],"status":"planned_not_implemented","upstream_surface":"learning_journey"},{"capability_id":"HERMES-CAP-GOAL","denied_raw_actions":["raw_goal_as_workflow_authority","hermes_judge_as_completion_authority","unbounded_resume"],"integration_points":["P3.1","P3.2","P3.3","P4.2","P4.4"],"offdata_mode":"workerpackage_completion_adapter_candidate","owning_imp_phases":["IMP-P3","IMP-P4"],"required_controls":["workerpackage_required","bounded_turn_budget","offdata_acceptance_is_authority","durable_offdata_checkpoint","explicit_stop_conditions"],"status":"planned_not_implemented","upstream_surface":"persistent_goal_and_completion_contract"},{"capability_id":"HERMES-CAP-DELEGATION","denied_raw_actions":["top_level_background_delegation","nested_delegation","parallel_fanout","direct_canonical_write"],"integration_points":["P3.1","P3.2","P3.3","P4.2","P4.4"],"offdata_mode":"raw_surface_denied_adapter_required","owning_imp_phases":["IMP-P3","IMP-P4"],"required_controls":["foreground_adapter","concurrency_one_until_proven","isolated_workspace","inherited_allowlist_only","parent_verification","idempotency"],"status":"planned_not_implemented","upstream_surface":"delegate_task_and_nested_orchestration"},{"capability_id":"HERMES-CAP-MOA","denied_raw_actions":["direct_provider_authority","moa_as_independent_qa","uncontrolled_reference_fanout"],"integration_points":["P4.3","P4.4"],"offdata_mode":"model_router_candidate_only","owning_imp_phases":["IMP-P4"],"required_controls":["offdata_router_owns_selection","explicit_cost_budget","provider_allowlist","evaluation_thresholds","advisory_reference_outputs"],"status":"planned_not_implemented","upstream_surface":"mixture_of_agents"},{"capability_id":"HERMES-CAP-MEMORY","denied_raw_actions":["autonomous_client_memory_write","canonical_memory_read","cross_engagement_profile"],"integration_points":["P2.2","P2.3","P4.1","P4.4","P11.2"],"offdata_mode":"noncanonical_ephemeral_or_suggestion_only","owning_imp_phases":["IMP-P2","IMP-P4","IMP-P11"],"required_controls":["canonical_state_external_to_hermes","no_client_truth","no_cross_engagement_recall","retention_policy","explicit_data_class_scope"],"status":"planned_not_implemented","upstream_surface":"persistent_memory_and_honcho_like_user_modeling"},{"capability_id":"HERMES-CAP-CURATOR","denied_raw_actions":["automatic_archive","automatic_patch","automatic_delete"],"integration_points":["P10.2","P10.3","P10.4"],"offdata_mode":"disabled_suggestions_may_be_reimplemented_offdata_side","owning_imp_phases":["IMP-P10"],"required_controls":["no_background_mutation","candidate_only_output","rollback_and_versioning"],"status":"planned_not_implemented","upstream_surface":"skill_curator_and_background_review"},{"capability_id":"HERMES-CAP-EXECUTE-CODE","denied_raw_actions":["unbounded_terminal_bridge","hidden_external_effects"],"integration_points":["P4.2","P4.4","P6.1","P6.4"],"offdata_mode":"bounded_worker_tool_candidate","owning_imp_phases":["IMP-P4","IMP-P6"],"required_controls":["declared_tool_classes","sandbox","reproducible_inputs","captured_outputs","no_direct_canonical_write"],"status":"planned_not_implemented","upstream_surface":"execute_code_programmatic_tool_calling"},{"capability_id":"HERMES-CAP-EXTERNAL-TOOLS","denied_raw_actions":["mcp_auto_enable","provider_gateway_auto_enable","credential_collection","unrestricted_browser"],"integration_points":["P4.2","P4.4","P5.2","P11.2","P11.3"],"offdata_mode":"denied_until_separate_tool_processor_review","owning_imp_phases":["IMP-P4","IMP-P5","IMP-P11"],"required_controls":["tool_allowlist","processor_review","credential_boundary","data_scope","network_scope","audit_log"],"status":"planned_not_implemented","upstream_surface":"mcp_tool_gateway_browser_and_external_skill_registries"},{"capability_id":"HERMES-CAP-RUNTIME-SURFACES","denied_raw_actions":["messaging_send","scheduled_external_action","background_session_authority","codex_runtime_auto_activation"],"integration_points":["P3.1","P3.2","P4.3","P9.4","P11.2","P11.3"],"offdata_mode":"deferred_replaceable_runtime_candidates","owning_imp_phases":["IMP-P3","IMP-P4","IMP-P9","IMP-P11"],"required_controls":["separate_activation_decision","durable_workflow_owned_by_offdata","external_send_policy","credential_review","kill_switch"],"status":"planned_not_implemented","upstream_surface":"messaging_cron_background_sessions_and_codex_app_server_runtime"}],"contract_id":"HERMES-BOUNDED-ADOPTION-REFRESH","delegation_policy":{"child_direct_canonical_write_authorized":false,"child_summary_is_verified_evidence":false,"hermes_process_is_durable_workflow_authority":false,"initial_adapter_concurrency_limit":1,"nested_delegation_authorized":false,"parallel_fanout_authorized":false,"parent_or_offdata_verification_required":true,"raw_delegate_task_authorized":false,"top_level_background_delegation_authorized":false},"generated_from":"configs/pcfa06-hermes-bounded-adoption-refresh.yaml","model_orchestration_policy":{"aggregator_must_obey_offdata_contracts":true,"evaluation_before_activation_required":true,"fanout_requires_explicit_cost_budget":true,"moa_counts_as_independent_quality_review":false,"moa_selected_directly_by_hermes":false,"moa_status":"candidate_only","offdata_model_router_owns_selection":true,"provider_allowlist_required":true,"reference_outputs_are_advisory":true},"operating_principles":[{"id":"HERMES-BOUND-01","statement":"offdata owns the consulting control plane, lifecycle, policy decisions and canonical engagement state; Hermes remains a replaceable runtime or worker candidate."},{"id":"HERMES-BOUND-02","statement":"Hermes session, goal, memory, skill, journey, background-task and subagent state are never canonical engagement truth."},{"id":"HERMES-BOUND-03","statement":"No raw Hermes surface may widen tools, data access, providers, credentials, external effects or approval scope beyond an offdata-issued package."},{"id":"HERMES-BOUND-04","statement":"Completion is determined by offdata acceptance evidence and tests, never solely by a Hermes judge, subagent summary or self-assessment."},{"id":"HERMES-BOUND-05","statement":"Hermes-created or Hermes-discovered skills remain candidates until independently reviewed, tested, provenance-checked and explicitly promoted through offdata governance."},{"id":"HERMES-BOUND-06","statement":"Background, nested or parallel execution is disabled unless a later implementation phase proves durability, isolation, idempotency, cost and policy conformance."},{"id":"HERMES-BOUND-07","statement":"Model fan-out and Mixture-of-Agents are advisory computation patterns behind the offdata model router and cannot themselves satisfy independent-quality requirements."},{"id":"HERMES-BOUND-08","statement":"Persistent memory and learning surfaces may suggest useful context or reusable procedures but cannot write client truth, methodology authority or approvals."},{"id":"HERMES-BOUND-09","statement":"External skill registries, MCP servers, tool gateways, messaging channels, scheduled jobs and provider integrations require separate allowlisting and applicable Founder approvals before use."},{"id":"HERMES-BOUND-10","statement":"Hermes adoption must remain removable without loss of canonical state, audit history, evidence, workflow checkpoints or deliverable provenance."}],"owner":"Founder","pcfa07_reconciliation_contract":{"every_capability_must_receive_dependencies":true,"every_capability_must_receive_evidence_type":true,"every_capability_must_receive_imp_task_ownership":true,"every_capability_must_receive_phase_gate":true,"every_capability_must_receive_planned_test_ids":true,"every_capability_must_receive_requirement_ids":true,"every_capability_must_remain_planned_not_implemented":true,"upstream_evidence_classification_must_be_preserved":true},"repository":"rayrayxing/offdata-os","schema_version":"1.0.0","scope_boundary":{"codex_start_authorized":false,"hermes_background_execution_authorized":false,"hermes_c